{
  "schema_version": "1.0.0",
  "experiment_id": "selection-dependent-countertable",
  "strict": true,
  "inference_track": "four_law",
  "selection": "state_dependent_unmodeled",
  "cluster_column": "cluster_id",
  "regime_column": "regime",
  "state_columns": ["x"],
  "candidate_state_blocks": [],
  "regimes": [
    {
      "id": "control",
      "design": {"bits": [false, false]},
      "sampling_proportion": 0.25,
      "perturbations": []
    },
    {
      "id": "tilt-a",
      "design": {"bits": [true, false]},
      "sampling_proportion": 0.25,
      "perturbations": ["a"]
    },
    {
      "id": "tilt-b",
      "design": {"bits": [false, true]},
      "sampling_proportion": 0.25,
      "perturbations": ["b"]
    },
    {
      "id": "tilt-ab",
      "design": {"bits": [true, true]},
      "sampling_proportion": 0.25,
      "perturbations": ["a", "b"]
    }
  ],
  "data": {
    "format": "csv",
    "path": "examples/data/selection_dependent.csv"
  },
  "seed": 20260812
}
